{"approved_manifest":{"approval_receipt":{"approved_at":"2026-08-05T02:01:59Z","approved_plan_digest":"36f6f43c59c315bccf086959a73c4a725a5be7b83c0975eaf21b7a53b1ff9a45","approver":"tyler","channel":"telegram","source_event_id":"telegram-thread-6273-first-formal-candidate-20260805-guo"},"manifest_id":"VPUB-20260805-live-guo","manifest_sha256":"213abaf7ede5b3645ecb95bef45b058995e9fa24b553b5012106c72b50f2b133","plan_digest":"36f6f43c59c315bccf086959a73c4a725a5be7b83c0975eaf21b7a53b1ff9a45"},"approved_receipt":{"created_at":"2026-08-05T02:01:59Z","receipt_sha256":"61109eb0c84b7162c8fd2c4eb3bbbec200835d72dbf33d25656a326bc09d2e77","release_digest":"2c38116a546f8b7336d7a9ee2366a9737e39c13c1a94ec4b48128b1549603770"},"base_path":"/Tyler-Vault_PaperNote_ReadingSite","candidate_digest":"48e030a5fd07321c130d25b144e08b81bb233b2dd0a5d44700f460e6ad6e6b7b","candidate_kind":"gh-pages-candidate","candidate_site":{"digest":"8e3de943400e5cae7825801ad12d7a905abd0b44871e8ec622ad73eb1db5403a","inventory":[{"byteLength":0,"path":".nojekyll","sha256":"e3b0c44298fc1c149afbf4c8996fb92427ae41e4649b934ca495991b7852b855"},{"byteLength":4777,"path":"404.html","sha256":"6ee17972c8924f807c27422efa9ed8d61bf0dc2f7b7e613168930f82265d0c82"},{"byteLength":485,"path":"component-274a3dfe.css","sha256":"274a3dfe526c0c6ae1ed3de2ddaeec43ffeebd826a2178a92d9158b3a209d0f1"},{"byteLength":88,"path":"component-53b25b2b.css","sha256":"53b25b2baef2f1527ac5650e5afa5ab51b829721d8940967f18fde80e41dc4b6"},{"byteLength":272,"path":"component-735924e0.css","sha256":"735924e004be71d672ba44eb4d5823c1761e4c537dd4bec27f3d31fc35d1f4b5"},{"byteLength":1145,"path":"component-788c9ca3.css","sha256":"788c9ca360917ead74f23bfdb31255325a2c629daa4dea5b4710441773807178"},{"byteLength":56,"path":"component-94cb6c84.css","sha256":"94cb6c840e211cc5d6b481f4abf290e68c23f5bfd04792bd5d4e9bd6360a04d5"},{"byteLength":2463,"path":"component-bbc3f7c0.css","sha256":"bbc3f7c0a27ed46590449921535a56272f46140b7b20be6052563eda8c59c209"},{"byteLength":2837,"path":"favicon.ico","sha256":"c3a4148c409eb206a4e24508e33acd74d67d8eed9d95c131b6ea3e1b5aef3170"},{"byteLength":2672,"path":"graph.json","sha256":"4c03157838fe83a99f5be781257932edb80abdf523e5c33f3c6bcd4131fbc153"},{"byteLength":29793,"path":"index-aaab3a00.css","sha256":"aaab3a006e53cc47100d98cb9b26afb5cd42e56ef610dcc1516f1d23f150e513"},{"byteLength":19520,"path":"index.html","sha256":"2535b81a63488ff78889298b50503fdb0e114441166e9f1bdd4b60c664af7c37"},{"byteLength":22934,"path":"knowledge/author/patricia-c-jackman/index.html","sha256":"ba252a957bd56c4168cd7b7136ef2bcc4e8c1c81464cdc016eaa25f670b4c130"},{"byteLength":24962,"path":"knowledge/concept/flow/index.html","sha256":"b0307a99e3d440873dfde0e8ed7faf388c15b1187cf2a2e9232792e4b76833e6"},{"byteLength":24593,"path":"knowledge/concept/micro-action/index.html","sha256":"e510e6e1f0607d7cca453b85ecb7895c161d1b7eb37a627783bd627041f5c6a3"},{"byteLength":23329,"path":"knowledge/method/connecting-analysis/index.html","sha256":"d228f11e5d8a802b3b3855b9929b6687871d7903dbbb8e7829a6ee53579c6c5f"},{"byteLength":24997,"path":"knowledge/method/event-focused-interview/index.html","sha256":"c79b227f3a3a5fa6d3a2fd99aa85180143cc93fdad94113979c6f2f69eb40d2a"},{"byteLength":23121,"path":"knowledge/method/thematic-analysis/index.html","sha256":"711b9f7d71e6e52dd7564044d98c46fb82c47084a354b6332c13d715f65f0f61"},{"byteLength":24860,"path":"knowledge/task/action-recognition/index.html","sha256":"b6242ba44891fee150c9a18db4e55c8ad600ee13df729208581e5601cd1e4c39"},{"byteLength":83551,"path":"papers/guo-2024-benchmarking-micro-action-recognition/index.html","sha256":"ca1b09b3306aab30786ad7b2204de1977c6bdfd6a286e5517843a71ba8d42628"},{"byteLength":87877,"path":"papers/jackman-2021-flow-clutch-recreational-running/index.html","sha256":"cd0b1a402378f1b2de60b21821c7735578aa4bbfe33d9b3ef34517a28933744c"},{"byteLength":230,"path":"postscript-f491e311.js","sha256":"f491e31137b223e6f35b38c1f9254dfd4eebc9d278ee695f65d54bbc75d03912"},{"byteLength":0,"path":"prescript-e3b0c442.js","sha256":"e3b0c44298fc1c149afbf4c8996fb92427ae41e4649b934ca495991b7852b855"},{"byteLength":71662,"path":"search-index.json","sha256":"cbe64c510d30d9e83cc58e4cb83f4db6fdbe3381d5606d974220466e874802db"},{"byteLength":71662,"path":"static/contentIndex.json","sha256":"cbe64c510d30d9e83cc58e4cb83f4db6fdbe3381d5606d974220466e874802db"},{"byteLength":4586,"path":"static/giscus/dark.css","sha256":"48b0c163db05f837ea30498e75eeb18e7c252e36a2c3b2d112e943804d6e856c"},{"byteLength":4678,"path":"static/giscus/light.css","sha256":"3ff726ca53fd62a9e948ad578dd758fc0c9e2899fdad7f7b8b8690a86867a3bf"},{"byteLength":17368,"path":"static/icon.png","sha256":"532d053e33c2c6bdefdd8145996cedc4be2fc32cfdac740c8488749457d131cf"},{"byteLength":46089,"path":"static/og-image.png","sha256":"6247780f1b51d0eb99eef6d86a5450e935c0b8053205b4ac83cedb05f0569bd8"},{"byteLength":5782,"path":"static/resource-after-5eb75950.js","sha256":"5eb7595090e1c6e6a52627450c4752ec0294bb19262d68216e234ce1c751af12"},{"byteLength":475,"path":"static/resource-after-8b336f9a.js","sha256":"8b336f9ab52938e6f7575a3426f8a3dae8a766dbe772b1d539084ddc205731b0"},{"byteLength":692,"path":"static/resource-after-baba652b.js","sha256":"baba652bd51ee9578827e01884e01e5e364cc8f88eb41f33cb9bb06df5b30fb9"},{"byteLength":1647,"path":"static/resource-after-e13fffa1.js","sha256":"e13fffa1497844ae87acda32dbb9fb68cb1679bf22d9feddd389cb43107a3fe6"},{"byteLength":2162,"path":"static/resource-style-6bd36952.css","sha256":"6bd369528496f0c37a4f5fcdcc6683e7c7e1f69ed754d13171fad271acc84436"},{"byteLength":453,"path":"static/resource-style-a5c806d2.css","sha256":"a5c806d268611721bc20b3d3df9e1c877076d26a9221bcf37ac4942ef3d29df2"},{"byteLength":456,"path":"static/scripts/script-0-f7c52b6a.js","sha256":"f7c52b6ad7a63606849b8e69cab346de257d910d91d70ce9792cccc271631db8"},{"byteLength":974,"path":"static/scripts/script-1-cc8afa9d.js","sha256":"cc8afa9d6f67588b69322d02076337cd9b6f4a8da177d4acced3d65e43816ff6"},{"byteLength":656,"path":"static/scripts/script-2-7e107d7e.js","sha256":"7e107d7e1765b42da7d15c1518044621f2b807cb805d4650d9d778be28f0ed86"},{"byteLength":235,"path":"static/scripts/script-3-51ee2d22.js","sha256":"51ee2d2223e67986abe8247dfaa148c097c81bf74e8da5669d06c8f01b286a55"}]},"expected_url":"https://eyeyesight.github.io/Tyler-Vault_PaperNote_ReadingSite/","rights_authority":{"approval_receipt":{"approved_at":"2026-08-05T02:01:59Z","approved_plan_digest":"36f6f43c59c315bccf086959a73c4a725a5be7b83c0975eaf21b7a53b1ff9a45","approver":"tyler","channel":"telegram","source_event_id":"telegram-thread-6273-first-formal-candidate-20260805-guo"},"kind":"publication-manifest-approval","manifest_id":"VPUB-20260805-live-guo","plan_digest":"36f6f43c59c315bccf086959a73c4a725a5be7b83c0975eaf21b7a53b1ff9a45","status":"approved"},"schema_version":1,"source_artifact":{"artifact_digest":"cc28024fa098c9a93eb2258e5e8922e9329a54be7f7146a74177c336eef7c4dc","byte_length":634139,"inventory":[{"byteLength":4777,"path":"404.html","sha256":"6ee17972c8924f807c27422efa9ed8d61bf0dc2f7b7e613168930f82265d0c82"},{"byteLength":485,"path":"component-274a3dfe.css","sha256":"274a3dfe526c0c6ae1ed3de2ddaeec43ffeebd826a2178a92d9158b3a209d0f1"},{"byteLength":88,"path":"component-53b25b2b.css","sha256":"53b25b2baef2f1527ac5650e5afa5ab51b829721d8940967f18fde80e41dc4b6"},{"byteLength":272,"path":"component-735924e0.css","sha256":"735924e004be71d672ba44eb4d5823c1761e4c537dd4bec27f3d31fc35d1f4b5"},{"byteLength":1145,"path":"component-788c9ca3.css","sha256":"788c9ca360917ead74f23bfdb31255325a2c629daa4dea5b4710441773807178"},{"byteLength":56,"path":"component-94cb6c84.css","sha256":"94cb6c840e211cc5d6b481f4abf290e68c23f5bfd04792bd5d4e9bd6360a04d5"},{"byteLength":2463,"path":"component-bbc3f7c0.css","sha256":"bbc3f7c0a27ed46590449921535a56272f46140b7b20be6052563eda8c59c209"},{"byteLength":2837,"path":"favicon.ico","sha256":"c3a4148c409eb206a4e24508e33acd74d67d8eed9d95c131b6ea3e1b5aef3170"},{"byteLength":2672,"path":"graph.json","sha256":"4c03157838fe83a99f5be781257932edb80abdf523e5c33f3c6bcd4131fbc153"},{"byteLength":29793,"path":"index-aaab3a00.css","sha256":"aaab3a006e53cc47100d98cb9b26afb5cd42e56ef610dcc1516f1d23f150e513"},{"byteLength":19520,"path":"index.html","sha256":"2535b81a63488ff78889298b50503fdb0e114441166e9f1bdd4b60c664af7c37"},{"byteLength":22934,"path":"knowledge/author/patricia-c-jackman/index.html","sha256":"ba252a957bd56c4168cd7b7136ef2bcc4e8c1c81464cdc016eaa25f670b4c130"},{"byteLength":24962,"path":"knowledge/concept/flow/index.html","sha256":"b0307a99e3d440873dfde0e8ed7faf388c15b1187cf2a2e9232792e4b76833e6"},{"byteLength":24593,"path":"knowledge/concept/micro-action/index.html","sha256":"e510e6e1f0607d7cca453b85ecb7895c161d1b7eb37a627783bd627041f5c6a3"},{"byteLength":23329,"path":"knowledge/method/connecting-analysis/index.html","sha256":"d228f11e5d8a802b3b3855b9929b6687871d7903dbbb8e7829a6ee53579c6c5f"},{"byteLength":24997,"path":"knowledge/method/event-focused-interview/index.html","sha256":"c79b227f3a3a5fa6d3a2fd99aa85180143cc93fdad94113979c6f2f69eb40d2a"},{"byteLength":23121,"path":"knowledge/method/thematic-analysis/index.html","sha256":"711b9f7d71e6e52dd7564044d98c46fb82c47084a354b6332c13d715f65f0f61"},{"byteLength":24860,"path":"knowledge/task/action-recognition/index.html","sha256":"b6242ba44891fee150c9a18db4e55c8ad600ee13df729208581e5601cd1e4c39"},{"byteLength":83551,"path":"papers/guo-2024-benchmarking-micro-action-recognition/index.html","sha256":"ca1b09b3306aab30786ad7b2204de1977c6bdfd6a286e5517843a71ba8d42628"},{"byteLength":87877,"path":"papers/jackman-2021-flow-clutch-recreational-running/index.html","sha256":"cd0b1a402378f1b2de60b21821c7735578aa4bbfe33d9b3ef34517a28933744c"},{"byteLength":230,"path":"postscript-f491e311.js","sha256":"f491e31137b223e6f35b38c1f9254dfd4eebc9d278ee695f65d54bbc75d03912"},{"byteLength":0,"path":"prescript-e3b0c442.js","sha256":"e3b0c44298fc1c149afbf4c8996fb92427ae41e4649b934ca495991b7852b855"},{"byteLength":71662,"path":"search